{
  "$schema": "http://json-schema.org/draft-07/schema#",
  "$id": "https://raw.githubusercontent.com/motebit/motebit/main/packages/wire-schemas/schema/execution-receipt-v1.json",
  "title": "ExecutionReceipt (v1)",
  "description": "motebit's signed per-task wire artifact. Canonicalization: JCS (RFC 8785). Signature: Ed25519 over canonicalJson(body minus signature), base64url-encoded. Public key: hex-encoded.",
  "type": "object",
  "properties": {
    "task_id": {
      "type": "string",
      "minLength": 1,
      "description": "Task identifier — UUID assigned at submission time; stable across retries."
    },
    "motebit_id": {
      "type": "string",
      "minLength": 1,
      "description": "Motebit identity — UUIDv7 string. Brand-checked at the type layer in @motebit/protocol; the wire shape is a non-empty string."
    },
    "public_key": {
      "type": "string",
      "description": "Signer's Ed25519 public key, hex-encoded. Optional because legacy pre-suite receipts omit it, but required for offline verification — present on every new receipt."
    },
    "device_id": {
      "type": "string",
      "minLength": 1,
      "description": "Device identity — UUIDv7 string for the signing device. Brand-checked at the type layer; the wire shape is a non-empty string."
    },
    "submitted_at": {
      "type": "number",
      "description": "Unix timestamp in milliseconds when the task was submitted."
    },
    "completed_at": {
      "type": "number",
      "description": "Unix timestamp in milliseconds when the task reached terminal state. Equal to `submitted_at` for instantaneous completions."
    },
    "status": {
      "type": "string",
      "enum": ["completed", "failed", "denied"],
      "description": "Terminal state of the task. `completed` = result produced and signed. `failed` = execution errored. `denied` = policy or budget gate rejected the invocation."
    },
    "result": {
      "type": "string",
      "description": "Final result payload as a string. Serialization format is task-specific; the receipt commits only to the bytes."
    },
    "tools_used": {
      "type": "array",
      "items": {
        "type": "string"
      },
      "description": "Names of tools invoked during execution. Empty array for pure-LLM or denied tasks."
    },
    "memories_formed": {
      "type": "integer",
      "minimum": 0,
      "description": "Count of memories the agent persisted during execution (≥ 0)."
    },
    "prompt_hash": {
      "type": "string",
      "description": "SHA-256 hex digest of the canonical prompt bytes. Lets verifiers prove a task matched a declared prompt without requiring the prompt itself."
    },
    "result_hash": {
      "type": "string",
      "description": "SHA-256 hex digest of the canonical result bytes. Pair with `result` for self-verification; with `prompt_hash` for prompt/result provenance."
    },
    "delegation_receipts": {
      "type": "array",
      "items": {
        "$ref": "#/definitions/ExecutionReceipt"
      },
      "description": "Nested receipts for subtasks this execution delegated. Recursive — builds the full delegation tree. Each nested receipt is independently signed by its executor."
    },
    "relay_task_id": {
      "type": "string",
      "description": "Relay's economic-identity binding for this task. **Required** for relay-mediated tasks (relay rejects receipts without it with HTTP 400). Optional for local execution."
    },
    "delegated_scope": {
      "type": "string",
      "description": "Scope from the delegation token that authorized this execution, if any. Present when the executor received a scoped token; absent for self-submitted tasks."
    },
    "invocation_origin": {
      "type": "string",
      "enum": ["user-tap", "ai-loop", "scheduled", "agent-to-agent"],
      "description": "How this task was authorized for invocation. `user-tap` = explicit affordance (surface determinism); `ai-loop` = model-mediated delegation; `scheduled` = cron; `agent-to-agent` = another motebit initiated it. Signature-bound — tampering breaks verification."
    },
    "suite": {
      "type": "string",
      "const": "motebit-jcs-ed25519-b64-v1",
      "description": "Cryptosuite identifier. Always `motebit-jcs-ed25519-b64-v1` for ExecutionReceipt today: JCS canonicalization (RFC 8785), Ed25519 signature, base64url-encoded signature, hex-encoded public key. See @motebit/protocol SUITE_REGISTRY."
    },
    "signature": {
      "type": "string",
      "description": "Base64url-encoded Ed25519 signature over `canonicalJson(body)` where `body` = this object minus `signature`. Verify with the embedded `public_key` using the suite recipe."
    }
  },
  "required": [
    "task_id",
    "motebit_id",
    "device_id",
    "submitted_at",
    "completed_at",
    "status",
    "result",
    "tools_used",
    "memories_formed",
    "prompt_hash",
    "result_hash",
    "suite",
    "signature"
  ],
  "additionalProperties": false,
  "definitions": {
    "ExecutionReceipt": {
      "type": "object",
      "properties": {
        "task_id": {
          "type": "string",
          "minLength": 1,
          "description": "Task identifier — UUID assigned at submission time; stable across retries."
        },
        "motebit_id": {
          "type": "string",
          "minLength": 1,
          "description": "Motebit identity — UUIDv7 string. Brand-checked at the type layer in @motebit/protocol; the wire shape is a non-empty string."
        },
        "public_key": {
          "type": "string",
          "description": "Signer's Ed25519 public key, hex-encoded. Optional because legacy pre-suite receipts omit it, but required for offline verification — present on every new receipt."
        },
        "device_id": {
          "type": "string",
          "minLength": 1,
          "description": "Device identity — UUIDv7 string for the signing device. Brand-checked at the type layer; the wire shape is a non-empty string."
        },
        "submitted_at": {
          "type": "number",
          "description": "Unix timestamp in milliseconds when the task was submitted."
        },
        "completed_at": {
          "type": "number",
          "description": "Unix timestamp in milliseconds when the task reached terminal state. Equal to `submitted_at` for instantaneous completions."
        },
        "status": {
          "type": "string",
          "enum": ["completed", "failed", "denied"],
          "description": "Terminal state of the task. `completed` = result produced and signed. `failed` = execution errored. `denied` = policy or budget gate rejected the invocation."
        },
        "result": {
          "type": "string",
          "description": "Final result payload as a string. Serialization format is task-specific; the receipt commits only to the bytes."
        },
        "tools_used": {
          "type": "array",
          "items": {
            "type": "string"
          },
          "description": "Names of tools invoked during execution. Empty array for pure-LLM or denied tasks."
        },
        "memories_formed": {
          "type": "integer",
          "minimum": 0,
          "description": "Count of memories the agent persisted during execution (≥ 0)."
        },
        "prompt_hash": {
          "type": "string",
          "description": "SHA-256 hex digest of the canonical prompt bytes. Lets verifiers prove a task matched a declared prompt without requiring the prompt itself."
        },
        "result_hash": {
          "type": "string",
          "description": "SHA-256 hex digest of the canonical result bytes. Pair with `result` for self-verification; with `prompt_hash` for prompt/result provenance."
        },
        "delegation_receipts": {
          "type": "array",
          "items": {
            "$ref": "#/definitions/ExecutionReceipt"
          },
          "description": "Nested receipts for subtasks this execution delegated. Recursive — builds the full delegation tree. Each nested receipt is independently signed by its executor."
        },
        "relay_task_id": {
          "type": "string",
          "description": "Relay's economic-identity binding for this task. **Required** for relay-mediated tasks (relay rejects receipts without it with HTTP 400). Optional for local execution."
        },
        "delegated_scope": {
          "type": "string",
          "description": "Scope from the delegation token that authorized this execution, if any. Present when the executor received a scoped token; absent for self-submitted tasks."
        },
        "invocation_origin": {
          "type": "string",
          "enum": ["user-tap", "ai-loop", "scheduled", "agent-to-agent"],
          "description": "How this task was authorized for invocation. `user-tap` = explicit affordance (surface determinism); `ai-loop` = model-mediated delegation; `scheduled` = cron; `agent-to-agent` = another motebit initiated it. Signature-bound — tampering breaks verification."
        },
        "suite": {
          "type": "string",
          "const": "motebit-jcs-ed25519-b64-v1",
          "description": "Cryptosuite identifier. Always `motebit-jcs-ed25519-b64-v1` for ExecutionReceipt today: JCS canonicalization (RFC 8785), Ed25519 signature, base64url-encoded signature, hex-encoded public key. See @motebit/protocol SUITE_REGISTRY."
        },
        "signature": {
          "type": "string",
          "description": "Base64url-encoded Ed25519 signature over `canonicalJson(body)` where `body` = this object minus `signature`. Verify with the embedded `public_key` using the suite recipe."
        }
      },
      "required": [
        "task_id",
        "motebit_id",
        "device_id",
        "submitted_at",
        "completed_at",
        "status",
        "result",
        "tools_used",
        "memories_formed",
        "prompt_hash",
        "result_hash",
        "suite",
        "signature"
      ],
      "additionalProperties": false
    }
  }
}
