{
  "task_id": "019dc500-0000-7000-c000-000000000d01",
  "motebit_id": "65b60673-d6ed-884b-b01c-2c222d82ada0",
  "device_id": "019dc500-0000-7000-a000-0000000000de",
  "submitted_at": 1777109400000,
  "completed_at": 1777109401000,
  "status": "denied",
  "result": "Attempted to send $4,800 to a new payee. Denied by policy. No funds moved.",
  "tools_used": [],
  "memories_formed": 0,
  "prompt_hash": "3d17f307d6b3ea82579c732cb7e928b838a96181699e5248e2467fd4dd5e3362",
  "result_hash": "25d83c75396ee98c9f66b93cf66bc452cb89c3195fa7c841a4bd2ac50613fe04",
  "invocation_origin": "user-tap",
  "public_key": "79b5562e8fe654f94078b112e8a98ba7901f853ae695bed7e0e3910bad049664",
  "suite": "motebit-jcs-ed25519-b64-v1",
  "signature": "9iwwMUljjBgkcjh497lDIM8GikYGmSeOPn2Wrh_RHit2pJaiUgx_o0Cv8Bc0Is5bMwyIM6rMraJFy4p4CbyQBA"
}
